"By enabling mealvouchers, you will be able to configure your products as 'Food and Drink', 'Home and Garden', or 'Gift and Flowers'. Simply note that the Worldline platform only allows one type of products per basket, and the plugin will automatically update the products of the basket that are missing a product type to the value recognized in the basket; in case of a mixed basket all products will be set to 'Food and Drink'","Wenn Sie Essensgutscheine aktivieren, können Sie Ihre Produkte als 'Food and Drink', 'Home and Garden', und 'Gift and Flowers' konfigurieren. Beachten Sie einfach, dass die Worldline-Plattform nur einen Produkttyp pro Warenkorb zulässt und das Plugin automatisch die Produkte des Warenkorbs, denen ein Produkttyp fehlt, auf den im Warenkorb erkannten Wert aktualisiert; bei einem gemischten Warenkorb werden alle Produkte auf 'Food and Drink' gesetzt"
"Configure your payment option as defined on your Oney 3x4x contract. You can find the value directly from your Oney interface.","Konfigurieren Sie Ihre Zahlungsoption wie in Ihrem Oney 3x4x-Vertrag definiert. Sie finden den Wert direkt in Ihrer Oney-Oberfläche."
"Group Cards","Gruppenkarten"
"Group credit and debit cards under one single button on the checkout page","Gruppieren Sie Kredit- und Debitkarten unter einer einzigen Schaltfläche auf der Checkout-Seite"
"Please go to an ATM to validate the Multibanco payment.","Bitte gehen Sie zu einem Geldautomaten, um die Multibanco-Zahlung zu validieren."
"Process Mealvouchers","Verfahren Mealvouchers"
